{
  "type": "agent-trace/v2",
  "who": {
    "agent": "dev3.direct.omp.01a14e79",
    "principal": "schickling",
    "actor": "schickling",
    "persona": "generalist",
    "supervisor": "dev3.01a14e79"
  },
  "why": { "step": { "name": "investigate" } },
  "how": {
    "harness": { "tool": "OMP", "version": "18.6.0" },
    "model": { "route": "anthropic/claude-opus-5-5", "effort": "medium" },
    "tooling_profile": "dotfiles@fixture-->",
    "runtime_profile": "runtime@fixture",
    "skills_manifest": "skills@fixture",
    "invocation_id": "invocation-direct",
    "issuance": { "_tag": "not-st-issued", "launcher": "agent-omp" }
  }
}
